id,title,link,series,author,rating_count,review_count,pages,score,date_published,first_published,genre,publisher,isbn,language,awards,isbn10,rating187065,New Spring,https://www.goodreads.com/book/show/187065.New_Spring,The Wheel of Time #0,Robert Jordan,"99,472","2,992",423,447,"December 2, 2004","January 6, 2004","Fantasy, Fiction, Epic Fantasy, High Fantasy, Science Fiction Fantasy, Audiobook, Adventure, Epic, Magic, Adult",Orbit,9781841492612,English,,1841492612,4.06
60662,El camino,https://www.goodreads.com/book/show/60662.El_camino,,Miguel Delibes,"9,285",611,224,447,"January 1, 2006","January 1, 1950","Classics, Fiction, Spanish Literature, Spain, Drama, Novels, 20th Century, School, Coming Of Age, Literature",Ediciones Destino,9788423334780,Spanish; Castilian,,8423334783,4.05
20767918,The Escape,https://www.goodreads.com/book/show/20767918-the-escape,John Puller #3,David Baldacci,"54,783","3,305",470,447,,"September 16, 2014","Thriller, Fiction, Mystery, Suspense, Crime, Audiobook, Mystery Thriller",,,,,,4.20
25788203,Before,https://www.goodreads.com/book/show/25788203-before,After #5,Anna Todd,"64,521","2,647",338,447,"December 8, 2015","December 8, 2015","Romance, New Adult, Young Adult, Contemporary, Fiction, Contemporary Romance, College, Audiobook, Love, Drama",Gallery Books,9781501130700,English,,1501130706,3.71
43706466,10 Minutes 38 Seconds in This Strange World,https://www.goodreads.com/book/show/43706466-10-minutes-38-seconds-in-this-strange-world,,Elif Shafak,"57,954","7,302",312,447,"January 1, 2019","June 1, 2019","Fiction, Contemporary, Historical Fiction, Literary Fiction, Novels, Audiobook, Turkish, Womens, Literature, Historical",Viking,9780241293867,English,,0241293863,4.09
49976087,"Take a Hint, Dani Brown",https://www.goodreads.com/book/show/49976087-take-a-hint-dani-brown,The Brown Sisters #2,Talia Hibbert,"92,966","14,236",400,447,"June 23, 2020","June 23, 2020","Romance, Contemporary, Fiction, Adult, Contemporary Romance, Audiobook, LGBT, Chick Lit, Mental Health, Queer",Avon,9780062941251,English,,0062941259,4.03
58051871,The High Auction,https://www.goodreads.com/book/show/58051871-the-high-auction,Wisdom Revolution #1,Misba,"6,966","1,000",164,447,"July 21, 2021","July 21, 2021","Fantasy, Science Fiction Fantasy, Post Apocalyptic, Science Fiction, Adventure, Dark, Adult, Thriller, Utopia, Fiction",Nomad's Forge,,English,,,4.58
223394,The Complete Poems,https://www.goodreads.com/book/show/223394.The_Complete_Poems,Poet to Poet Series,Percy Bysshe Shelley,"8,350",78,944,446,,"January 1, 1839","Poetry, Classics, Literature, Romanticism, Fiction, 19th Century, British Literature",,,,,,4.09
39242,The Milagro Beanfield War,https://www.goodreads.com/book/show/39242.The_Milagro_Beanfield_War,The New Mexico Trilogy #1,John Nichols,"10,384",515,456,446,"February 15, 2000","January 1, 1974","Fiction, Magical Realism, Historical Fiction, Humor, Novels, Literature, Classics, Contemporary, Literary Fiction, American",Owl Books,9780805063745,English,,0805063749,4.09
1421046,Supernova: Petir,https://www.goodreads.com/book/show/1421046.Supernova,Supernova #3,Dee Lestari,"9,356",761,201,446,"January 1, 2004","January 1, 2004","Fiction, Novels, Indonesian Literature, Fantasy, Science Fiction, Romance, Literature, Philosophy, Adult, Mystery",AKOER - Andal Krida Nusantara,(ISBN10:,Indonesian,,,3.95
16178,Dairy Queen,https://www.goodreads.com/book/show/16178.Dairy_Queen,Dairy Queen #1,Catherine Gilbert Murdock,"27,832","2,709",275,446,"May 22, 2006","May 22, 2006","Young Adult, Contemporary, Sports, Romance, Realistic Fiction, Fiction, Teen, Chick Lit, Audiobook, Coming Of Age",Houghton Mifflin,9780618683079,English,,0618683070,3.74
31426,,https://www.goodreads.com/book/show/31426.The_Collected_Poems,,,,,,446,,,,,,,,,
3354025,Queen of Song and Souls,https://www.goodreads.com/book/show/3354025-queen-of-song-and-souls,Tairen Soul #4,C.L. Wilson,"9,801",438,389,446,"October 27, 2009","October 27, 2009","Fantasy, Romance, Fantasy Romance, Magic, Paranormal, Fae, Paranormal Romance, Adult, High Fantasy, Shapeshifters",Leisure Books,9780843960600,English,,0843960604,4.28
6621143,Something Like Fate,https://www.goodreads.com/book/show/6621143-something-like-fate,,Susane Colasanti,"19,963","1,384",268,446,"May 4, 2010","May 4, 2010","Young Adult, Romance, Contemporary, Realistic Fiction, Chick Lit, High School, Teen, Fiction, Young Adult Romance, Young Adult Contemporary",Viking Juvenile,9780670011469,English,,0670011460,3.68
6345760,The Magician's Elephant,https://www.goodreads.com/book/show/6345760-the-magician-s-elephant,,Kate DiCamillo,"25,317","3,698",201,446,"September 8, 2009","September 8, 2009","Fantasy, Fiction, Middle Grade, Childrens, Young Adult, Magic, Juvenile, Animals, Magical Realism, Adventure",Candlewick Press,9780763644109,English,,0763644102,3.86
721003,Peak,https://www.goodreads.com/book/show/721003.Peak,Peak #1,Roland Smith,"20,392","2,735",246,446,"May 1, 2007","May 1, 2007","Young Adult, Adventure, Realistic Fiction, Fiction, Survival, Middle Grade, Sports, School, Teen, Contemporary",Clarion Books,9780152024178,English,,0152024174,3.98
240009,The Interesting Narrative of the Life of Olaudah Equiano,https://www.goodreads.com/book/show/240009.The_Interesting_Narrative_of_the_Life_of_Olaudah_Equiano,,Olaudah Equiano,"12,929",625,256,446,"April 7, 2006","January 1, 1789","History, Nonfiction, Classics, Biography, Memoir, Africa, Autobiography, School, 18th Century, Biography Memoir",Bedford/St. Martin's,9780312442033,English,,0312442033,3.74
68496,Un Lun Dun,https://www.goodreads.com/book/show/68496.Un_Lun_Dun,,China Miéville,"18,838","2,016",432,446,"February 13, 2007","February 13, 2007","Fantasy, Young Adult, Fiction, Urban Fantasy, Steampunk, Childrens, Adventure, Science Fiction, Science Fiction Fantasy, Middle Grade",Del Rey,9780345495167,English,,0345495160,3.83
24903031,Blood Kiss,https://www.goodreads.com/book/show/24903031-blood-kiss,Black Dagger Legacy #1,J.R. Ward,"29,272","2,557",397,446,"December 1, 2015","December 1, 2015","Paranormal, Paranormal Romance, Vampires, Romance, Fantasy, Urban Fantasy, Adult, Fiction, Supernatural, Audiobook",Signet,9780451475329,English,,0451475321,4.32
126192,Mythago Wood,https://www.goodreads.com/book/show/126192.Mythago_Wood,Mythago Wood #1,Robert Holdstock,"9,994",927,332,446,"September 1, 2003","January 1, 1984","Fantasy, Fiction, Mythology, Horror, Urban Fantasy, Science Fiction Fantasy, Classics, British Literature, Science Fiction, Novels",Orb Books,9780765307293,English,,0765307294,3.78
27287136,Bounty from the Box: The CSA Farm Cookbook,https://www.goodreads.com/book/show/27287136-bounty-from-the-box,,Mi Ae Lipe,110,5,712,446,"October 13, 2015","Published October 13, 2015","Cookbooks, Cooking, Culinary, New Adult, Adult",Twisted Carrot Publishing LLC,9780990501107,English,,0990501108,4.36
48829708,To Sleep in a Sea of Stars,https://www.goodreads.com/book/show/48829708-to-sleep-in-a-sea-of-stars,Fractalverse #1,Christopher Paolini,"53,925","8,897",880,446,"September 15, 2020","September 15, 2020","Science Fiction, Fiction, Fantasy, Audiobook, Adult, Space Opera, Space, Aliens, Science Fiction Fantasy, Young Adult",Tor Books,9781250762849,English,,1250762847,3.79
50323,"The Complete Far Side, 1980–1994",https://www.goodreads.com/book/show/50323.The_Complete_Far_Side_1980_1994,,Gary Larson,"7,007",234,1272,445,"September 1, 2003","September 1, 2003","Comics, Humor, Fiction, Graphic Novels, Comedy, Comic Strips, Art, Graphic Novels Comics, Cartoon, Comic Book",Andrews McMeel Publishing,9780740721137,English,,0740721135,4.69
