id,title,link,series,author,rating_count,review_count,pages,score,date_published,first_published,genre,publisher,isbn,language,awards,isbn10,rating
9915,Less Than Zero,https://www.goodreads.com/book/show/9915.Less_Than_Zero,,Bret Easton Ellis,"83,254","4,820",208,"3,939","June 9, 2010","May 1, 1985","Fiction, Contemporary, Novels, American, Classics, Literature, Literary Fiction, Coming Of Age, 20th Century, The United States Of America",Vintage Books,,English,,,3.60
61975,Dragonflight,https://www.goodreads.com/book/show/61975.Dragonflight,Dragonriders of Pern #1,Anne McCaffrey,"135,539","4,126",299,"3,938","July 26, 2005","July 1, 1968","Fantasy, Science Fiction, Dragons, Fiction, Science Fiction Fantasy, Young Adult, High Fantasy, Time Travel, Adventure, Romance",Del Rey,9780345484260,English,,0345484266,4.09
29780253,Born a Crime: Stories From a South African Childhood,https://www.goodreads.com/book/show/29780253-born-a-crime,,Trevor Noah,"655,880","54,062",289,"3,938","November 15, 2016","November 15, 2016","Nonfiction, Memoir, Biography, Audiobook, Humor, Autobiography, Africa, Biography Memoir, Race, South Africa",Doubleday Canada,,English,,,4.49
6431790,Fang,https://www.goodreads.com/book/show/6431790-fang,Maximum Ride #6,James Patterson,"60,652","2,713",309,"3,934","March 15, 2010","March 15, 2010","Young Adult, Fantasy, Science Fiction, Fiction, Adventure, Romance, Paranormal, Action, Teen, Dystopia","Little, Brown and Company",9780316036191,English,,0316036196,4.05
285205,Blood Bound,https://www.goodreads.com/book/show/285205.Blood_Bound,Mercy Thompson #2,Patricia Briggs,"126,409","4,707",292,"3,931","January 30, 2007","January 30, 2007","Urban Fantasy, Fantasy, Paranormal, Vampires, Romance, Werewolves, Paranormal Romance, Shapeshifters, Fiction, Supernatural",Ace,9780441014736,English,,0441014739,4.31
420404,Yertle the Turtle and Other Stories,https://www.goodreads.com/book/show/420404.Yertle_the_Turtle_and_Other_Stories,,Dr. Seuss,"34,951",720,80,"3,929","April 12, 1958","April 12, 1958","Childrens, Picture Books, Fiction, Classics, Poetry, Humor, Animals, Fantasy, Kids, Short Stories",Random House Books for Young Readers,9780394900872,English,,0394900871,4.15
676737,Grendel,https://www.goodreads.com/book/show/676737.Grendel,,John Gardner,"38,073","2,626",174,"3,926","June 2, 2010","August 12, 1971","Fiction, Fantasy, Classics, Mythology, School, Literature, Novels, Retellings, High School, Literary Fiction",Random House Vintage Books,9780679723110,English,,0679723110,3.69
61439040,1984,https://www.goodreads.com/book/show/61439040-1984,,George Orwell,"4,383,447","108,876",368,"3,910","July 1, 2022","June 8, 1949","Classics, Fiction, Science Fiction, Dystopia, Literature, Politics, Novels, School, Fantasy, Adult",Plume,9780452284234,English,,0452284236,4.19
9462812,Die for Me,https://www.goodreads.com/book/show/9462812-die-for-me,Revenants #1,Amy Plum,"55,066","4,543",341,"3,908","May 10, 2011","May 10, 2011","Young Adult, Paranormal, Fantasy, Romance, Paranormal Romance, Zombies, Supernatural, Urban Fantasy, Fiction, Young Adult Paranormal",HarperTeen,9780062004017,English,,0062004018,3.98
106085,Masquerade,https://www.goodreads.com/book/show/106085.Masquerade,Blue Bloods #2,Melissa de la Cruz,"90,649","2,214",307,"3,906","May 1, 2007","May 1, 2007","Young Adult, Vampires, Fantasy, Paranormal, Romance, Supernatural, Angels, Fiction, Urban Fantasy, Paranormal Romance",Hyperion,9780786838936,English,,0786838930,3.91
1472878,Firefly Lane,https://www.goodreads.com/book/show/1472878.Firefly_Lane,Firefly Lane #1,Kristin Hannah,"372,391","28,557",479,"3,906","February 5, 2008","February 5, 2008","Fiction, Chick Lit, Romance, Contemporary, Historical Fiction, Audiobook, Adult, Adult Fiction, Drama, Book Club",St. Martin's Press,9780312364083,English,,0312364083,4.16
18130,A Wind in the Door,https://www.goodreads.com/book/show/18130.A_Wind_in_the_Door,Time Quintet #2,Madeleine L'Engle,"126,324","4,201",236,"3,905","March 1, 1976","January 1, 1973","Fantasy, Young Adult, Fiction, Science Fiction, Childrens, Classics, Middle Grade, Science Fiction Fantasy, Adventure, Audiobook",Dell Laurel-Leaf,9780440487616,English,,,3.99
33413128,Beartown,https://www.goodreads.com/book/show/33413128-beartown,Beartown #1,Fredrik Backman,"399,126","45,346",432,"3,896","April 25, 2017","September 15, 2016","Fiction, Contemporary, Audiobook, Sports, Adult, Literary Fiction, Adult Fiction, Book Club, Sweden, Realistic Fiction",Simon & Schuster,(ISBN10:,English,,,4.29
28249,The Magicians' Guild,https://www.goodreads.com/book/show/28249.The_Magicians_Guild,The Black Magician Trilogy #1,Trudi Canavan,"82,839","3,329",467,"3,893","January 31, 2004","October 24, 2001","Fantasy, Magic, Young Adult, Fiction, High Fantasy, Epic Fantasy, Adventure, Science Fiction Fantasy, Romance, Adult",Orbit,9781841493138,English,,1841493139,3.95
25883848,The Hating Game,https://www.goodreads.com/book/show/25883848-the-hating-game,,Sally Thorne,"669,910","67,596",387,"3,889","August 9, 2016","August 9, 2016","Romance, Contemporary, Contemporary Romance, Fiction, Chick Lit, Adult, Audiobook, New Adult, Humor, Adult Fiction",William Morrow Paperbacks,,English,,,3.91
3128411,Bone Crossed,https://www.goodreads.com/book/show/3128411-bone-crossed,Mercy Thompson #4,Patricia Briggs,"108,479","3,532",292,"3,887","February 5, 2009","February 3, 2009","Urban Fantasy, Fantasy, Paranormal, Vampires, Romance, Werewolves, Paranormal Romance, Shapeshifters, Fiction, Fae",Orbit,9781841496863,English,,1841496863,4.34
10629,Christine,https://www.goodreads.com/book/show/10629.Christine,,Stephen King,"235,800","5,069",411,"3,876","June 13, 2001","April 29, 1983","Horror, Fiction, Thriller, Fantasy, Supernatural, Paranormal, Mystery, Audiobook, Suspense, Adult",LGF,9782253147695,French,,2253147699,3.83
12936,Gathering Blue,https://www.goodreads.com/book/show/12936.Gathering_Blue,The Giver #2,Lois Lowry,"187,099","12,918",240,"3,875","September 25, 2000","September 1, 2000","Young Adult, Dystopia, Fiction, Fantasy, Science Fiction, Middle Grade, Classics, Childrens, Audiobook, Teen",Delacorte Press,9780385732567,English,,0385732562,3.82
42058,Richard III,https://www.goodreads.com/book/show/42058.Richard_III,Wars of the Roses #8,William Shakespeare,"52,542","2,485",414,"3,865","January 1, 2000","January 1, 1593","Classics, Plays, Drama, Fiction, Historical Fiction, Theatre, School, Literature, Poetry, Historical",Oxford University Press,9780192839930,English,,0192839934,3.91
22544764,Uprooted,https://www.goodreads.com/book/show/22544764-uprooted,,Naomi Novik,"229,243","28,729",438,"3,862","May 19, 2015","May 19, 2015","Fantasy, Young Adult, Fiction, Romance, Magic, Fairy Tales, Retellings, High Fantasy, Adult, Audiobook",Del Rey,9780804179034,English,"Hugo Award Nominee for Best Novel (2016), Nebula Award for Best Novel (2015), Locus Award for Best Fantasy Novel (2016), World Fantasy Award Nominee for Best Novel (2016), Mythopoeic Fantasy Award for Adult Literature (2016), British Fantasy Award for Best Fantasy Novel (the Robert Holdstock Award) (2016), Goodreads Choice Award Nominee for Young Adult Fantasy & Science Fiction (2015), RUSA CODES Reading List for Fantasy (2016)",0804179034,4.04
822989,"My Story: ""A Child Called It"", ""The Lost Boy"", ""A Man Named Dave""",https://www.goodreads.com/book/show/822989.My_Story,,Dave Pelzer,"13,396",742,437,"3,861","January 1, 2002","January 1, 1995","Nonfiction, Biography, Memoir, Autobiography, Psychology, True Story, Abuse, Biography Memoir, Adult, Crime",Orion Books,9780752853710,English,,0752853716,4.21
35642518,For the Love of Armin,https://www.goodreads.com/book/show/35642518-for-the-love-of-armin,,Michael G. Kramer,"1,133",26,325,"3,859","May 25, 2017","August 31, 2015","Fiction, Adventure, Historical Fiction, New Adult, Young Adult, Historical, Adult, Novels, Love Story, Romance",,,English,,,4.30
32071,Sons and Lovers,https://www.goodreads.com/book/show/32071.Sons_and_Lovers,,D.H. Lawrence,"52,376","2,407",654,"3,858","August 17, 1999","January 1, 1913","Classics, Fiction, Literature, Novels, British Literature, Romance, 20th Century, Classic Literature, Banned Books, English Literature",Modern Library Classics,,English,,,3.64
28421168,Renegades,https://www.goodreads.com/book/show/28421168-renegades,Renegades #1,Marissa Meyer,"133,538","17,541",552,"3,857","November 7, 2017","November 7, 2017","Fantasy, Young Adult, Science Fiction, Dystopia, Fiction, Superheroes, Audiobook, Young Adult Fantasy, Adventure, Urban Fantasy",Feiwel & Friends,9781250044662,English,,1250044669,4.14
13628209,The Boy Who Sneaks in My Bedroom Window,https://www.goodreads.com/book/show/13628209-the-boy-who-sneaks-in-my-bedroom-window,The Boy Who Sneaks in My Bedroom Window #1,Kirsty Moseley,"75,585","5,821",256,"3,849","April 28, 2012","April 29, 2011","Romance, Young Adult, Contemporary, New Adult, High School, Abuse, Contemporary Romance, Young Adult Romance, Chick Lit, Love",Createspace,,English,,,3.85
20821111,The Young Elites,https://www.goodreads.com/book/show/20821111-the-young-elites,The Young Elites #1,Marie Lu,"133,638","15,086",355,"3,848","October 7, 2014","October 7, 2014","Fantasy, Young Adult, Dystopia, Romance, Fiction, Young Adult Fantasy, Magic, High Fantasy, Science Fiction, Paranormal",G.P. Putnam’s Sons Books for Young Readers,9780399167836,English,,0399167838,3.87
8492319,Lover Unleashed,https://www.goodreads.com/book/show/8492319-lover-unleashed,Black Dagger Brotherhood #9,J.R. Ward,"92,520","4,319",512,"3,832","March 29, 2011","March 1, 2011","Paranormal, Paranormal Romance, Romance, Vampires, Fantasy, Urban Fantasy, Adult, Fiction, Erotica, Supernatural",NAL,9780451233165,English,"All About Romance (AAR) Annual Reader Poll for Guiltiest Pleasure AND Most Disappointing Romance (2012), Romantic Times Reviewers' Choice Award (RT Award) for Vampire Romance (2011), The Romance Reviews (TRR) Award for Best Paranormal Romance AND Best Paranormal Vampire Romance (2011), Goodreads Choice Award for Romance (2011)",0451233166,4.27
752900,Medea,https://www.goodreads.com/book/show/752900.Medea,,Euripides,"73,413","3,089",59,"3,830","April 19, 1993","January 1, 432","Classics, Plays, Drama, Mythology, Fiction, Theatre, School, Literature, Read For School, Tragedy",Dover Publications,9780486275482,English,,0486275485,3.93
1540,"The Oedipus Cycle: Oedipus Rex, Oedipus at Colonus, Antigone",https://www.goodreads.com/book/show/1540.The_Oedipus_Cycle,The Theban Plays #1–3,Sophocles,"66,273","2,340",259,"3,824","November 1, 2002","January 1, 451","Plays, Drama, Fiction, Mythology, School, Classics, Literature, Theatre, Poetry, Read For School",Mariner Books,9780156027649,English,,015602764X,3.98
119829,The Sunne in Splendour,https://www.goodreads.com/book/show/119829.The_Sunne_in_Splendour,,Sharon Kay Penman,"21,686","1,396",936,"3,821","January 14, 1990","October 1, 1982","Historical Fiction, Fiction, Historical, Medieval, British Literature, 15th Century, Romance, Plantagenet, War, Historical Romance",Ballantine Books,9780345363138,English,,0345363132,4.40
9822,Mrs. Frisby and the Rats of NIMH,https://www.goodreads.com/book/show/9822.Mrs_Frisby_and_the_Rats_of_NIMH,Rats of NIMH #1,Robert C. O'Brien,"176,525","4,510",240,"3,815","May 1, 2003","January 1, 1971","Fantasy, Fiction, Childrens, Classics, Young Adult, Middle Grade, Animals, Adventure, Science Fiction, Juvenile",Aladdin,9780689862205,English,"Newbery Medal (1972), Lewis Carroll Shelf Award (1972), Massachusetts Children's Book Award (1978), Vermont Golden Dome Book Award Nominee (1973), Pacific Northwest Library Association Young Reader's Choice Award (1974), Boston Globe-Horn Book Award Nominee for Fiction (1971), California Young Readers Medal Nominee for Intermediate (1975), William Allen White Children's Book Award (1974), Bluestem Book Award Nominee (2017)",0689862202,4.16
41742807,Archibald Finch and the Lost Witches,https://www.goodreads.com/book/show/41742807-archibald-finch-and-the-lost-witches,Archibald Finch #1,Michel Guyon,497,147,350,"3,812","October 8, 2018","October 8, 2018","Fantasy, Middle Grade, Adventure, Witches, Fiction, Childrens, Magic, Audiobook, Science Fiction Fantasy, Mythology",Line 8,9781732569928,English,,1732569924,4.10
50531218,The Hawthorne Legacy,https://www.goodreads.com/book/show/50531218-the-hawthorne-legacy,The Inheritance Games #2,Jennifer Lynn Barnes,"341,151","36,494",380,"3,802","September 7, 2021","September 7, 2021","Mystery, Young Adult, Romance, Fiction, Contemporary, Mystery Thriller, Thriller, Fantasy, Audiobook, Adventure",Penguin,9780241480748,English,,0241480744,4.23
18798983,The Wrath and the Dawn,https://www.goodreads.com/book/show/18798983-the-wrath-and-the-dawn,The Wrath and the Dawn #1,Renée Ahdieh,"172,541","23,160",416,"3,800","May 12, 2015","May 12, 2015","Fantasy, Young Adult, Romance, Retellings, Fiction, Young Adult Fantasy, Historical Fiction, Magic, Fairy Tales, Historical",G.P. Putnam's Sons Books for Young Readers,9780399171611,English,,0399171614,4.06
43352954,This is How You Lose the Time War,https://www.goodreads.com/book/show/43352954-this-is-how-you-lose-the-time-war,,Amal El-Mohtar,"168,888","34,052",209,"3,800","July 16, 2019","July 16, 2019","Science Fiction, Romance, Fiction, Fantasy, LGBT, Queer, Time Travel, Lesbian, Adult, Novella",Saga Press,,English,"Hugo Award for Best Novella (2020), Nebula Award for Best Novella (2019), Locus Award for Best Novella (2020), British Science Fiction Association Award for Best Shorter Fiction (2019), Shirley Jackson Award Nominee for Novella (2020), Theodore Sturgeon Memorial Award Nominee (2020), Los Angeles Times Book Prize Nominee for Science Fiction, Fantasy & Speculative Fiction (Ray Bradbury Prize) (2020), Prix Aurora Award for Best Short Fiction (2020), The Kitschies Nominee for Red Tentacle (Novel) and Inky Tentacle (Cover Art) (2019), Goodreads Choice Award Nominee for Science Fiction (2019), Brooklyn Public Library Literary Prize Nominee for Fiction and Poetry (2020), Reddit r/fantasy Stabby Award for Best Novella (2019), Ignyte Award for Best Novella (2020)",,3.94
12657,The Source,https://www.goodreads.com/book/show/12657.The_Source,,James A. Michener,"42,985","1,662",1080,"3,799","July 1, 2002","January 1, 1965","Historical Fiction, Fiction, Historical, Israel, Religion, Jewish, Novels, Judaism, Classics, Archaeology","Random House, Inc.",9780375760389,English,,0375760385,4.30
56495,The Purpose Driven Life: What on Earth Am I Here for?,https://www.goodreads.com/book/show/56495.The_Purpose_Driven_Life,,Rick Warren,"268,452","3,856",336,"3,799","February 20, 2007","January 1, 2002","Christian, Nonfiction, Religion, Self Help, Spirituality, Christianity, Faith, Christian Living, Inspirational, Theology",Zondervan Publishing Company,9780310276999,English,,0310276993,3.96
16243767,Crossing the Seas: A Diary of My Thoughts,https://www.goodreads.com/book/show/16243767-crossing-the-seas,,Yuehai Xiao,"2,149",29,328,"3,797","October 9, 2012","October 8, 2012","Nonfiction, Contemporary",AuthorHouse,9781477276068,English,,1477276068,3.56
284996,The Complete Stories,https://www.goodreads.com/book/show/284996.The_Complete_Stories,,Flannery O'Connor,"38,759","2,050",555,"3,789","January 1, 1971","November 8, 1971","Short Stories, Fiction, Classics, Literature, Southern Gothic, Southern, American, Literary Fiction, 20th Century, Gothic","Farrar, Straus & Giroux",,English,,,4.39
40121378,Atomic Habits: An Easy & Proven Way to Build Good Habits & Break Bad Ones,https://www.goodreads.com/book/show/40121378-atomic-habits,,James Clear,"736,196","48,267",319,"3,788",,"October 16, 2018","Nonfiction, Self Help, Psychology, Personal Development, Productivity, Audiobook, Business",,,,,,4.37
13033,The Alexandria Quartet,https://www.goodreads.com/book/show/13033.The_Alexandria_Quartet,Alexandria Quartet #1-4,Lawrence Durrell,"11,818",512,884,"3,786","December 1, 1991","January 1, 1960","Fiction, Classics, Historical Fiction, Literature, Egypt, Novels, Africa, Literary Fiction, British Literature, 20th Century",Penguin Group USA,9780140153170,English,,0140153179,4.17
111450,Quidditch Through the Ages,https://www.goodreads.com/book/show/111450.Quidditch_Through_the_Ages,Hogwarts Library #2,J.K. Rowling,"175,705","6,752",105,"3,781",,"March 12, 2001","Fantasy, Fiction, Young Adult, Childrens, Magic, Middle Grade, Audiobook",,,,,,3.81
6342491,The Demon King,https://www.goodreads.com/book/show/6342491-the-demon-king,Seven Realms #1,Cinda Williams Chima,"75,598","5,879",506,"3,777","October 6, 2009","October 6, 2009","Fantasy, Young Adult, Magic, Romance, Young Adult Fantasy, High Fantasy, Fiction, Adventure, Epic Fantasy, Science Fiction Fantasy",Hyperion Books,9781423118237,English,,1423118235,4.15
40725379,"Animal, Vegetable, Miracle: A Year of Food Life",https://www.goodreads.com/book/show/40725379-animal-vegetable-miracle,,Barbara Kingsolver,"109,268","11,268",383,"3,773","May 2, 2017","May 1, 2007","Nonfiction, Food, Memoir, Gardening, Health, Environment, Nature, Audiobook, Cooking, Biography",Harper,,English,,,4.04
235718,Succubus Blues,https://www.goodreads.com/book/show/235718.Succubus_Blues,Georgina Kincaid #1,Richelle Mead,"56,648","3,172",343,"3,772","March 1, 2007","February 27, 2007","Urban Fantasy, Paranormal, Fantasy, Romance, Paranormal Romance, Vampires, Demons, Adult, Angels, Supernatural",Kensington,9780758216410,English,,0758216416,3.94
1829709,The Final Warning,https://www.goodreads.com/book/show/1829709.The_Final_Warning,Maximum Ride #4,James Patterson,"70,337","2,736",256,"3,769","March 17, 2008","March 17, 2008","Young Adult, Fantasy, Science Fiction, Fiction, Adventure, Paranormal, Romance, Teen, Action, Childrens",Jimmy Patterson,9780316002868,English,,0316002860,3.85
38726615,Ana Rocha: Shadows of Justice,https://www.goodreads.com/book/show/38726615-ana-rocha,,Ammar Habib,"5,494",639,218,"3,764","February 23, 2018","Published February 23, 2018","Thriller, Crime, Action, Police, Fiction, Mystery",CreateSpace Independent Publishing Platform,9781985736139,English,,1985736136,4.23
53450218,The Past,https://www.goodreads.com/book/show/53450218-the-past,VanWest #1,Kenneth Thomas,744,211,195,"3,761","May 1, 2020","Published May 1, 2020","Science Fiction, Historical, Science Fiction Fantasy, Unfinished, Young Adult",,9781838056117,English,,,3.86
33160963,The Seven Husbands of Evelyn Hugo,https://www.goodreads.com/book/show/33160963-the-seven-husbands-of-evelyn-hugo,,Taylor Jenkins Reid,"2,595,847","243,280",385,"3,760","May 29, 2018","June 13, 2017","Fiction, Romance, Historical Fiction, LGBT, Contemporary, Audiobook, Queer, Historical, Adult, Lesbian",Washington Square Press,9781501161933,English,,1501161938,4.44
56060300,Heartstopper: Volume Four,https://www.goodreads.com/book/show/56060300-heartstopper,Heartstopper #4,Alice Oseman,"344,092","33,886",384,"3,757","January 4, 2022","May 6, 2021","Graphic Novels, Romance, LGBT, Young Adult, Contemporary, Queer, Comics, Fiction, Mental Health, Gay",Graphix,9781338617566,English,,1338617567,4.62
11468377,"Thinking, Fast and Slow",https://www.goodreads.com/book/show/11468377-thinking-fast-and-slow,,Daniel Kahneman,"474,657","16,244",499,"3,748","October 25, 2011","October 25, 2011","Nonfiction, Psychology, Self Help, Business, Personal Development, Philosophy, Audiobook, Unfinished, Leadership, Productivity","Farrar, Straus and Giroux",9780374275631,English,,0374275637,4.18
58937530,Forty-Ninth,https://www.goodreads.com/book/show/58937530-forty-ninth,,Boris Pronsky,98,11,187,"3,748","October 1, 2021","October 1, 2021","Historical Fiction, Novels, Fiction, American History, Historical, Russian History, 19th Century, Adventure, Literature, Audiobook",,,English,,,4.34
781787,Out of Africa,https://www.goodreads.com/book/show/781787.Out_of_Africa,,Isak Dinesen,"42,962","2,563",401,"3,747","January 1, 1992","January 1, 1937","Nonfiction, Africa, Classics, Memoir, Biography, Travel, History, Biography Memoir, Autobiography, Kenya",The Modern Library,9780679600213,English,,0679600213,3.92
29236380,Girl in Pieces,https://www.goodreads.com/book/show/29236380-girl-in-pieces,,Kathleen Glasgow,"158,565","18,195",416,"3,740","August 30, 2016","August 30, 2016","Young Adult, Mental Health, Contemporary, Fiction, Romance, Mental Illness, Realistic Fiction, Audiobook, Young Adult Contemporary, Abuse",Delacorte Press,9781101934715,English,,1101934719,4.01
3992598,The Demigod Files,https://www.goodreads.com/book/show/3992598-the-demigod-files,Percy Jackson and the Olympians,Rick Riordan,"104,681","3,999",151,"3,738","February 10, 2009","February 10, 2009","Fantasy, Mythology, Young Adult, Middle Grade, Fiction, Short Stories, Adventure, Greek Mythology, Urban Fantasy, Childrens",Disney-Hyperion Books,9781423121664,English,,142312166X,4.03
13089710,The Kill Order,https://www.goodreads.com/book/show/13089710-the-kill-order,The Maze Runner #0.4,James Dashner,"217,973","11,376",327,"3,736","August 14, 2012","August 14, 2012","Young Adult, Dystopia, Science Fiction, Fiction, Fantasy, Post Apocalyptic, Adventure, Audiobook, Teen, Action",Delacorte Books for Young Readers,9780385742887,English,,0385742886,3.71
28251,The High Lord,https://www.goodreads.com/book/show/28251.The_High_Lord,The Black Magician Trilogy #3,Trudi Canavan,"58,272","1,955",644,"3,736","November 4, 2004","December 18, 2002","Fantasy, Magic, Young Adult, Fiction, High Fantasy, Romance, Epic Fantasy, Adventure, Science Fiction Fantasy, Audiobook",Orbit,9781841493152,English,,1841493155,4.14
19161852,The Fifth Season,https://www.goodreads.com/book/show/19161852-the-fifth-season,The Broken Earth #1,N.K. Jemisin,"252,249","28,594",468,"3,731","August 4, 2015","August 4, 2015","Fantasy, Fiction, Science Fiction, Dystopia, Adult, Audiobook, Science Fiction Fantasy, LGBT, High Fantasy, Post Apocalyptic",Orbit,,English,"Hugo Award for Best Novel (2016), Nebula Award Nominee for Best Novel (2015), Locus Award Nominee for Best Fantasy Novel (2016), World Fantasy Award Nominee for Best Novel (2016), Grand Prix de l'Imaginaire Nominee for Traduction (2018) (2019), James Tiptree Jr. Award Nominee for Longlist (2015), Premio Ignotus Nominee for Mejor novela extranjera - Best Foreign Novel (2018), Tähtifantasia Award Nominee (2022), The Kitschies Nominee for Red Tentacle (Novel) (2015), Goodreads Choice Award Nominee for Fantasy (2015), Dragon Award Nominee for Best Fantasy Novel and Best Apocalyptic Novel (2016), Prêmio LeBlanc Nominee for Romance Estrangeiro de Fantasia, Ficção Científica ou Terror Publicado em Língua Portuguesa (2018), RUSA CODES Reading List Nominee for Fantasy (2016)",,4.31
318525,Red Storm Rising,https://www.goodreads.com/book/show/318525.Red_Storm_Rising,,Tom Clancy,"78,745","1,395",Audio,"3,727","September 13, 1988","August 28, 1986","Fiction, Thriller, Military Fiction, War, Action, Espionage, Suspense, Adventure, Historical Fiction, Mystery",Random House Audio,9780394298665,English,,0394298667,4.20
7544603,Smaragdgrün,https://www.goodreads.com/book/show/7544603-smaragdgr-n,Edelstein-Trilogie #3,Kerstin Gier,"96,959","6,744",487,"3,710","December 8, 2010","December 8, 2010","Fantasy, Young Adult, Time Travel, Romance, Historical Fiction, Fiction, Science Fiction, Paranormal, Historical, Urban Fantasy",Arena Verlag,9783401063485,German,,3401063480,4.20
42080479,The School for Good and Evil,https://www.goodreads.com/book/show/42080479-the-school-for-good-and-evil,The School for Good and Evil #1,Soman Chainani,"113,348","12,432",488,"3,703","September 4, 2018","May 14, 2013","Fantasy, Middle Grade, Young Adult, Fiction, Romance, Magic, Fairy Tales, Childrens, Adventure, Audiobook",HarperCollins,9780062104908,English,,006210490X,3.99
43330,Master of the Game,https://www.goodreads.com/book/show/43330.Master_of_the_Game,The Game #1,Sidney Sheldon,"56,512","2,139",489,"3,702","January 1, 1993","August 1, 1982","Fiction, Thriller, Mystery, Suspense, Mystery Thriller, Romance, Drama, Novels, Historical Fiction, Crime",Harper Collins Publisher,9780006472612,English,,0006472613,4.14
2517,My Name Is Red,https://www.goodreads.com/book/show/2517.My_Name_Is_Red,,Orhan Pamuk,"55,344","5,081",417,"3,690","August 27, 2002","January 1, 1998","Fiction, Historical Fiction, Mystery, Literature, Turkish, Novels, Turkish Literature, Nobel Prize, Historical, Art",Vintage,,English,,,3.87
43945,Portnoy’s Complaint,https://www.goodreads.com/book/show/43945.Portnoy_s_Complaint,,Philip Roth,"67,196","3,916",274,"3,670","May 18, 1995","January 1, 1969","Fiction, Classics, Novels, Literature, American, Humor, Jewish, Literary Fiction, The United States Of America, Americana",Vintage,,English,,,3.70
76865,Good to Great: Why Some Companies Make the Leap... and Others Don't,https://www.goodreads.com/book/show/76865.Good_to_Great,,James C. Collins,"198,643","5,759",300,"3,666","October 16, 2001","November 1, 2001","Business, Nonfiction, Leadership, Management, Self Help, Buisness, Entrepreneurship, Personal Development, Audiobook, Economics",HarperBusiness,9780066620992,English,,0066620996,4.14
12513614,Captive in the Dark,https://www.goodreads.com/book/show/12513614-captive-in-the-dark,The Dark Duet #1,C.J. Roberts,"71,786","6,403",276,"3,666","July 20, 2011","August 29, 2011","Dark, Romance, BDSM, Adult, Contemporary, Abuse, Erotica, Contemporary Romance, New Adult, Erotic Romance",CJ Roberts,2940011444937,English,,,3.94
