id,title,link,series,author,rating_count,review_count,pages,score,date_published,first_published,genre,publisher,isbn,language,awards,isbn10,rating
241823,Women Who Run With the Wolves,https://www.goodreads.com/book/show/241823.Women_Who_Run_With_the_Wolves,,Clarissa Pinkola Estés,"71,149","5,462",537,"1,855","September 1, 1995","January 1, 1992","Nonfiction, Feminism, Psychology, Spirituality, Mythology, Self Help, Womens, Philosophy, Gender, Audiobook",Ballantine Books,9780345409874,English,,0345409876,4.13
15768191,Sweet Peril,https://www.goodreads.com/book/show/15768191-sweet-peril,Sweet #2,Wendy Higgins,"47,421","2,932",375,"1,854","April 28, 2013","April 30, 2013","Fantasy, Young Adult, Romance, Paranormal, Angels, Paranormal Romance, Demons, Supernatural, Urban Fantasy, Young Adult Fantasy",HarperTeen,9780062265944,English,,0062265946,4.24
57280624,"Stop Overthinking: 23 Techniques to Relieve Stress, Stop Negative Spirals, Declutter Your Mind, and Focus on the Present",https://www.goodreads.com/book/show/57280624-stop-overthinking,,Nick Trenton,"3,239",258,191,"1,853","March 1, 2021","Published March 1, 2021","Self Help, Nonfiction, Psychology, Mental Health, Personal Development, Health, Audiobook, Productivity, Business, Education",NCTS Inc.,,English,,,3.82
9681214,The Goddess Test,https://www.goodreads.com/book/show/9681214-the-goddess-test,Goddess Test #1,Aimee Carter,"57,893","5,385",293,"1,850","April 26, 2011","April 19, 2011","Fantasy, Young Adult, Mythology, Romance, Paranormal, Greek Mythology, Fiction, Retellings, Paranormal Romance, Young Adult Fantasy",Harlequin Teen,9780373210268,English,,0373210264,3.79
21535271,The Slow Regard of Silent Things,https://www.goodreads.com/book/show/21535271-the-slow-regard-of-silent-things,The Kingkiller Chronicle #2.5,Patrick Rothfuss,"141,249","12,580",159,"1,849","October 28, 2014","October 28, 2014","Fantasy, Fiction, Novella, High Fantasy, Short Stories, Epic Fantasy, Science Fiction Fantasy, Audiobook, Adult, Magic",DAW Books,9780756410438,English,,0756410436,3.89
40395,A Princess of Mars,https://www.goodreads.com/book/show/40395.A_Princess_of_Mars,Barsoom #1,Edgar Rice Burroughs,"56,785","4,096",186,"1,849","January 30, 2007","February 7, 1912","Science Fiction, Fantasy, Classics, Fiction, Adventure, Pulp, Science Fiction Fantasy, Romance, Audiobook, Novels",Penguin Books,9780143104889,English,,0143104888,3.81
40121205,Broken Promises,https://www.goodreads.com/book/show/40121205-broken-promises,Past Imperfect Mystery #1,Anne Willow,"2,820",34,229,"1,849","May 13, 2018","Published May 13, 2018","Young Adult, Fiction, New Adult, Contemporary, Adult, Romance, Mystery, Novels, Love Story, Chick Lit",Between the Lines Publishing,,English,,,4.25
592657,Deliverance,https://www.goodreads.com/book/show/592657.Deliverance,,James Dickey,"32,193","1,589",278,"1,846","September 10, 1994","January 1, 1970","Fiction, Classics, Thriller, Horror, Adventure, Novels, Literature, Southern, Literary Fiction, Suspense",Delta,9780385313872,English,,038531387X,3.89
8709524,Silver Shadows,https://www.goodreads.com/book/show/8709524-silver-shadows,Bloodlines #5,Richelle Mead,"60,007","4,890",380,"1,846","July 29, 2014","July 29, 2014","Young Adult, Fantasy, Vampires, Paranormal, Romance, Urban Fantasy, Magic, Supernatural, Paranormal Romance, Fiction",Razorbill,9781595143211,English,,1595143211,4.34
39101777,Surrounded by Idiots,https://www.goodreads.com/book/show/39101777-surrounded-by-idiots,The Surrounded by Idiots,Thomas Erikson,"35,097","3,168",11,"1,844","July 30, 2019","June 4, 2014","Nonfiction, Psychology, Self Help, Business, Audiobook, Personal Development, Communication, Leadership, Management, Sociology",Macmillan Audio,9781250234001,English,,125023400X,3.47
69091,The Clown,https://www.goodreads.com/book/show/69091.The_Clown,,Heinrich Böll,"28,113","1,915",272,"1,843","January 1, 1994","January 1, 1963","Fiction, German Literature, Classics, Novels, Germany, Literature, Nobel Prize, 20th Century, Literary Fiction, Unfinished",Penguin Group USA,9780140187267,English,,014018726X,3.95
51497,The Strange Case of Dr. Jekyll and Mr. Hyde and Other Tales of Terror,https://www.goodreads.com/book/show/51497.The_Strange_Case_of_Dr_Jekyll_and_Mr_Hyde_and_Other_Tales_of_Terror,,Robert Louis Stevenson,"125,531","2,634",224,"1,843","February 27, 2003","January 5, 1886","Classics, Horror, Fiction, Gothic, Science Fiction, Mystery, Short Stories, Fantasy, Literature, 19th Century",Penguin Classics,9780141439730,English,,0141439734,3.93
23846013,The Rose Society,https://www.goodreads.com/book/show/23846013-the-rose-society,The Young Elites #2,Marie Lu,"63,295","7,334",398,"1,843","October 13, 2015","October 13, 2015","Fantasy, Young Adult, Dystopia, Romance, Young Adult Fantasy, Fiction, Magic, High Fantasy, Science Fiction, Paranormal",G.P. Putnam's Sons Books for Young Readers,9780399167843,English,,0399167846,4.03
13545075,UnWholly,https://www.goodreads.com/book/show/13545075-unwholly,Unwind Dystology #2,Neal Shusterman,"58,102","5,076",416,"1,842","August 28, 2012","August 28, 2012","Young Adult, Dystopia, Science Fiction, Fiction, Fantasy, Horror, Teen, Thriller, Romance, Adventure",Simon Schuster Books for Young Readers,9781442423688,English,,1442423684,4.24
3018539,Death with Interruptions,https://www.goodreads.com/book/show/3018539-death-with-interruptions,,José Saramago,"57,729","5,828",238,"1,842","October 6, 2008","January 1, 2005","Fiction, Fantasy, Magical Realism, Portugal, Portuguese Literature, Literature, Novels, Nobel Prize, Classics, Death",Houghton Mifflin Harcourt,9780151012749,English,,0151012741,4.00
6696602,Infinity,https://www.goodreads.com/book/show/6696602-infinity,Chronicles of Nick #1,Sherrilyn Kenyon,"42,001","3,194",464,"1,841","May 25, 2010","May 25, 2010","Young Adult, Fantasy, Paranormal, Urban Fantasy, Vampires, Zombies, Demons, Supernatural, Fiction, Romance",St. Martin's Griffin,9780312599072,English,,0312599072,4.03
52762903,The Book of Lost Names,https://www.goodreads.com/book/show/52762903-the-book-of-lost-names,,Kristin Harmel,"173,819","16,558",388,"1,841","July 21, 2020","July 21, 2020","Historical Fiction, Fiction, World War II, Historical, Audiobook, Romance, War, Holocaust, Books About Books, Adult",Gallery Books,9781982131890,English,,1982131896,4.42
11691,Snow,https://www.goodreads.com/book/show/11691.Snow,,Orhan Pamuk,"45,907","4,158",463,"1,840","August 1, 2005","January 1, 2002","Fiction, Literature, Contemporary, Turkish, Turkish Literature, Novels, Historical Fiction, Nobel Prize, Literary Fiction, Unfinished",Vintage Books,,English,,,3.61
61205183,True Teryn,https://www.goodreads.com/book/show/61205183-true-teryn,The Last Lumenian #2,S.G. Blaise,952,123,311,"1,840","December 3, 2021","Published December 3, 2021","Fantasy, Fiction, Science Fiction, Novels, Contemporary, Drama, Romance",Lilac Grove Entertainment LLC,9781734760545,English,,1734760540,4.32
5047880,Hunger,https://www.goodreads.com/book/show/5047880-hunger,Gone #2,Michael Grant,"85,382","3,901",590,"1,839","May 26, 2009","May 26, 2009","Young Adult, Dystopia, Fantasy, Science Fiction, Fiction, Paranormal, Horror, Adventure, Romance, Supernatural",Katherine Tegen Books,,English,,,4.02
16130537,The Humans,https://www.goodreads.com/book/show/16130537-the-humans,,Matt Haig,"111,636","12,878",285,"1,838","July 2, 2013","May 9, 2013","Fiction, Science Fiction, Fantasy, Humor, Contemporary, Audiobook, Adult, Aliens, Novels, Adult Fiction",Simon & Schuster,9781476727912,English,,1476727910,4.08
61459992,The Paris Affair,https://www.goodreads.com/book/show/61459992-the-paris-affair,,Melanie Hudson,"1,838",103,376,"1,835","September 16, 2022","September 16, 2022","Historical Fiction, Fiction, Historical, Holocaust, War, World War II, France",One More Chapter,9780008420956,English,,0008420955,4.47
63278248,Dead Fall,https://www.goodreads.com/book/show/63278248-dead-fall,Scot Harvath #22,Brad Thor,"8,292",378,320,"1,835","July 11, 2023","July 11, 2023","Thriller, Fiction, Mystery, Spy Thriller, Espionage, Mystery Thriller, Audiobook, Military Fiction, Suspense, Action",Atria/Emily Bestler Books,,English,,,4.42
20257122,"Finding Me: A Decade of Darkness, a Life Reclaimed - A Memoir of the Cleveland Kidnappings",https://www.goodreads.com/book/show/20257122-finding-me,,Michelle Knight,"27,212","2,607",252,"1,833","May 6, 2014","May 16, 2014","Nonfiction, True Crime, Memoir, Biography, Crime, Biography Memoir, Autobiography, Abuse, Audiobook, Survival",Hachette Books,9781602862562,English,,1602862567,4.16
6315602,My Soul to Take,https://www.goodreads.com/book/show/6315602-my-soul-to-take,Soul Screamers #1,Rachel Vincent,"42,166","2,727",279,"1,832","February 2, 2009","August 1, 2009","Young Adult, Paranormal, Fantasy, Romance, Urban Fantasy, Paranormal Romance, Supernatural, Mystery, Ghosts, Fiction",Harlequin Teen,9780373210039,English,,0373210035,3.87
2153780,Hold Me Tight: Seven Conversations for a Lifetime of Love,https://www.goodreads.com/book/show/2153780.Hold_Me_Tight,,Sue Johnson,"17,382","1,143",300,"1,832","April 8, 2008","April 8, 2008","Relationships, Nonfiction, Psychology, Self Help, Marriage, Love, Counselling, Personal Development, Mental Health, Communication","Little, Brown Spark",9780316113007,English,,031611300X,4.11
57693429,The Body Code: Unlocking Your Body's Ability to Heal Itself,https://www.goodreads.com/book/show/57693429-the-body-code,,Bradley Nelson,342,35,400,"1,832","February 21, 2023","Published February 21, 2023","Health, Self Help, Nonfiction, Spirituality, Science, Psychology, Mental Health",St. Martin's Essentials,9781250773821,English,,1250773822,4.08
92250,Millennium Approaches,https://www.goodreads.com/book/show/92250.Millennium_Approaches,Angels in America #1,Tony Kushner,"23,565",542,119,"1,831","May 1, 1993","February 13, 1992","Plays, Drama, LGBT, Fiction, Theatre, Queer, Classics, School, Fantasy, Read For School",Theatre Communications Group,9781559360616,English,,1559360615,4.26
460635,The Bone People,https://www.goodreads.com/book/show/460635.The_Bone_People,,Keri Hulme,"22,262","2,124",450,"1,831","October 7, 1986","January 1, 1984","Fiction, Magical Realism, Literary Fiction, Historical Fiction, Contemporary, Fantasy, Literature, Novels, 20th Century, Book Club",Penguin Books,9780140089226,English,,0140089225,4.04
18077875,Essentialism: The Disciplined Pursuit of Less,https://www.goodreads.com/book/show/18077875-essentialism,,Greg McKeown,"105,759","11,133",260,"1,831","April 15, 2014","December 31, 2011","Nonfiction, Self Help, Business, Productivity, Personal Development, Psychology, Philosophy, Audiobook, Leadership, Management",Crown Currency,9780804137386,English,,0804137382,4.07
56468461,Back To You,https://www.goodreads.com/book/show/56468461-back-to-you,,Steve Bates,"3,182",48,254,"1,831","January 5, 2021","January 5, 2021","Fiction, Time Travel, Novels, Contemporary, Drama, Science Fiction, Fantasy, Humor, Science Fiction Fantasy, Epic",White Bird Publications,,English,,,4.25
54552798,The Ancestor,https://www.goodreads.com/book/show/54552798-the-ancestor,,Lee Matthew Goldberg,"3,540",298,348,"1,830","August 21, 2020","August 21, 2020","Fiction, Contemporary, Thriller, Historical Fiction, Drama, Novels, Science Fiction, Mystery Thriller, Mystery, Adventure",All Due Respect,9781643961149,English,,1643961144,4.26
18149927,Beneath This Man,https://www.goodreads.com/book/show/18149927-beneath-this-man,This Man #2,Jodi Ellen Malpas,"91,623","4,431",452,"1,829","June 18, 2013","January 15, 2013","Romance, Erotica, BDSM, Contemporary Romance, Contemporary, Erotic Romance, Adult, New Adult, Love, Fiction",Forever,,English,,,4.26
5196,Tara Road,https://www.goodreads.com/book/show/5196.Tara_Road,,Maeve Binchy,"78,971","2,408",648,"1,828","January 1, 1988","January 1, 1998","Fiction, Chick Lit, Romance, Ireland, Contemporary, Irish Literature, Adult Fiction, Novels, Adult, Womens Fiction",Dell,9780440235590,English,,0440235596,3.93
37586,The Lost Colony,https://www.goodreads.com/book/show/37586.The_Lost_Colony,Artemis Fowl #5,Eoin Colfer,"155,107","2,256",385,"1,827","September 15, 2006","September 15, 2006","Fantasy, Young Adult, Fiction, Science Fiction, Middle Grade, Adventure, Childrens, Magic, Urban Fantasy, Audiobook",Miramax Books/Hyperion Books for Children,,English,,,4.01
44525305,The Ride of a Lifetime: Lessons Learned from 15 Years as CEO of the Walt Disney Company,https://www.goodreads.com/book/show/44525305-the-ride-of-a-lifetime,,Robert Iger,"77,638","5,947",272,"1,827","September 23, 2019","September 23, 2019","Business, Biography, Nonfiction, Leadership, Memoir, Audiobook, Management, Autobiography, Biography Memoir, Self Help",Random House,,English,,,4.42
49631287,The Mountains Sing,https://www.goodreads.com/book/show/49631287-the-mountains-sing,,Nguyễn Phan Quế Mai,"39,618","5,563",352,"1,825","March 17, 2020","March 17, 2020","Historical Fiction, Fiction, Asia, Historical, War, Audiobook, Literary Fiction, Asian Literature, Adult, Book Club",Algonquin Books,9781616208189,English,,161620818X,4.32
20912424,The War That Saved My Life,https://www.goodreads.com/book/show/20912424-the-war-that-saved-my-life,The War That Saved My Life #1,Kimberly Brubaker Bradley,"95,666","11,943",316,"1,824","January 8, 2015","January 8, 2015","Historical Fiction, Middle Grade, Fiction, Young Adult, Historical, World War II, Childrens, War, Audiobook, Juvenile",Dial Books,9780803740815,English,"Newbery Medal Nominee (2016), Schneider Family Book Award for Middle School (2016), Odyssey Award (2016), Vermont Golden Dome Book Award Nominee (2017), California Young Readers Medal for Intermediate (2019), Judy Lopez Memorial Award for Children's Literature (2016), Bluestem Book Award Nominee (2017), Goodreads Choice Award Nominee for Middle Grade & Children's (2015), Rebecca Caudill Young Readers' Book Award Nominee (2017)",0803740816,4.49
43868109,Empire of Pain: The Secret History of the Sackler Dynasty,https://www.goodreads.com/book/show/43868109-empire-of-pain,,Patrick Radden Keefe,"92,762","10,920",535,"1,824","April 13, 2021","April 13, 2021","Nonfiction, History, Audiobook, Biography, True Crime, Business, Science, Politics, Medicine, Crime",Doubleday,9780385545686,English,"British Book Award Nominee for Non-Fiction: Narrative (2022), PEN/John Kenneth Galbraith Award for Nonfiction Nominee for Longlist (2022), Financial Times Business Book of the Year Nominee for Shortlist (2021), National Book Critics Circle Award Nominee for Nonfiction (2021), Andrew Carnegie Medal Nominee for Nonfiction (2022), Goodreads Choice Award for History & Biography (2021), The Baillie Gifford Prize for Non-Fiction (2021), ALCS Dagger for Non-fiction Nominee (2022)",0385545681,4.54
56653002,Twisted Games,https://www.goodreads.com/book/show/56653002-twisted-games,Twisted #2,Ana Huang,"413,889","38,700",456,"1,823","July 29, 2021","July 29, 2021","Romance, Contemporary, Contemporary Romance, New Adult, Adult, Audiobook, Dark, Love",,,English,,,4.13
17143,Go Tell It on the Mountain,https://www.goodreads.com/book/show/17143.Go_Tell_It_on_the_Mountain,,James Baldwin,"65,975","4,687",256,"1,822","January 1, 2001","May 18, 1953","Fiction, Classics, African American, Race, Literature, Religion, Novels, Historical Fiction, Literary Fiction, American",Penguin,9780141185910,English,,0141185910,4.04
8811134,Fear,https://www.goodreads.com/book/show/8811134-fear,Gone #5,Michael Grant,"50,340","2,169",509,"1,822","April 3, 2012","April 3, 2012","Young Adult, Dystopia, Science Fiction, Fantasy, Fiction, Horror, Paranormal, Romance, Adventure, Supernatural",Katherine Tegen Books,9780061449154,English,,0061449156,4.23
530848,Eighth Grade Bites,https://www.goodreads.com/book/show/530848.Eighth_Grade_Bites,The Chronicles of Vladimir Tod #1,Heather Brewer,"36,372","2,865",182,"1,822","August 16, 2007","August 1, 2007","Young Adult, Vampires, Fantasy, Paranormal, Fiction, Supernatural, Horror, Teen, Urban Fantasy, Middle Grade",Dutton Children's Books,9780525478119,English,,0525478116,3.93
6164358,The Mysterious Benedict Society and the Prisoner's Dilemma,https://www.goodreads.com/book/show/6164358-the-mysterious-benedict-society-and-the-prisoner-s-dilemma,The Mysterious Benedict Society #3,Trenton Lee Stewart,"40,868","1,926",400,"1,821","October 27, 2009","October 6, 2009","Mystery, Fiction, Middle Grade, Young Adult, Adventure, Fantasy, Childrens, Science Fiction, Audiobook, Realistic Fiction","Little, Brown Books for Young Readers",9780307582393,English,,0307582396,4.29
91477,Fool Moon,https://www.goodreads.com/book/show/91477.Fool_Moon,The Dresden Files #2,Jim Butcher,"191,063","9,013",401,"1,821","January 9, 2001","January 1, 2001","Fantasy, Urban Fantasy, Mystery, Fiction, Paranormal, Magic, Audiobook, Supernatural, Science Fiction Fantasy, Werewolves",Roc,9780451458124,English,,0451458125,3.99
10016013,Harry Potter and the Methods of Rationality,https://www.goodreads.com/book/show/10016013-harry-potter-and-the-methods-of-rationality,Harry Potter and the Methods of Rationality,Eliezer Yudkowsky,"16,761","1,680",2184,"1,820","March 14, 2015","March 14, 2015","Fantasy, Fiction, Fan Fiction, Philosophy, Science Fiction, Young Adult, Humor, Magic, Unfinished, Psychology",hpmor.com & fanfiction.net,,English,,,4.39
41193,A Thousand Acres,https://www.goodreads.com/book/show/41193.A_Thousand_Acres,,Jane Smiley,"67,707","3,497",371,"1,819","December 2, 2003","January 1, 1991","Fiction, Literary Fiction, Contemporary, Literature, Novels, Family, Adult Fiction, Historical Fiction, Classics, American",Anchor,9781400033836,English,"Pulitzer Prize for Fiction (1992), Ambassador Book Award for Fiction (1992), Los Angeles Times Book Prize Nominee for Fiction (1992), Chicago Tribune Heartland Prize for Fiction (1991), National Book Critics Circle Award for Fiction (1991), Society of Midland Authors Award for Fiction (1992)",1400033837,3.82
25454056,Sword of Destiny,https://www.goodreads.com/book/show/25454056-sword-of-destiny,The Witcher #0.7,Andrzej Sapkowski,"175,029","9,701",405,"1,819","May 19, 2015","May 21, 1992","Fantasy, Fiction, Short Stories, Audiobook, High Fantasy, Adventure, Polish Literature, Adult, Magic, Epic Fantasy",Orbit,,English,,,4.27
8204005,Love Unscripted,https://www.goodreads.com/book/show/8204005-love-unscripted,Love #1,Tina Reber,"68,018","3,512",668,"1,819","March 6, 2010","March 6, 2010","Romance, Contemporary, Contemporary Romance, New Adult, Adult, Chick Lit, Love, Erotica, Fiction, Young Adult",CreateSpace Independent Publishing Platform,9781451533965,English,,1451533969,4.02
14376,Einstein’s Dreams,https://www.goodreads.com/book/show/14376.Einstein_s_Dreams,,Alan Lightman,"39,114","4,079",144,"1,817","November 9, 2004","January 1, 1993","Fiction, Short Stories, Philosophy, Science Fiction, Historical Fiction, Fantasy, Physics, Literature, Novels, Time Travel",Vintage,9781400077809,English,,140007780X,4.07
40604754,Heir to the Empire,https://www.goodreads.com/book/show/40604754-heir-to-the-empire,Star Wars: The Thrawn Trilogy #1,Timothy Zahn,"88,905","4,319",434,"1,817","June 28, 2011","May 1, 1991","Star Wars, Science Fiction, Fiction, Fantasy, Space Opera, Science Fiction Fantasy, Audiobook, Adventure, Novels, Space",Del Rey,,English,,,4.16
46231,The Portable Dorothy Parker,https://www.goodreads.com/book/show/46231.The_Portable_Dorothy_Parker,,Dorothy Parker,"11,745",621,610,"1,812","December 9, 1976","May 1, 1944","Poetry, Short Stories, Fiction, Classics, Humor, Essays, Literature, 20th Century, Anthologies, Womens",Penguin Books,9780140150742,English,,0140150749,4.34
17235026,The Girl with All the Gifts,https://www.goodreads.com/book/show/17235026-the-girl-with-all-the-gifts,The Girl With All the Gifts #1,M.R. Carey,"223,056","22,603",461,"1,811","June 19, 2014","January 14, 2014","Horror, Fiction, Science Fiction, Zombies, Dystopia, Post Apocalyptic, Fantasy, Audiobook, Thriller, Adult",Orbit,9780356500157,English,"Arthur C. Clarke Award Nominee (2015), Audie Award for Paranormal (2015), British Fantasy Award Nominee for August Derleth Award (best horror novel) (2015), Tähtivaeltaja Award Nominee (2017), Goodreads Choice Award Nominee for Horror (2014), James Herbert Award Nominee (2015)",0356500152,3.95
75461169,A Day of Reckoning,https://www.goodreads.com/book/show/75461169-a-day-of-reckoning,,Matthew Harffy,322,25,448,"1,811","September 28, 2023","Published September 28, 2023","Historical Fiction, Anglo Saxon",Head of Zeus -- an Aries Book,9781804548578,English,,180454857X,4.39
18163202,Wolf's Head,https://www.goodreads.com/book/show/18163202-wolf-s-head,The Forest Lord #1,Steven A. McKay,"2,297",223,326,"1,809","July 3, 2013","July 2, 2013","Historical Fiction, Fantasy, Fiction, Historical, Adventure, Medieval, Retellings, Action, 14th Century, British Literature",Broadsword Publishing,,English,,,4.00
67035,Relic,https://www.goodreads.com/book/show/67035.Relic,Aloysius Pendergast #1,Douglas Preston,"106,430","4,348",480,"1,807","August 1, 2005","January 1, 1995","Horror, Thriller, Mystery, Fiction, Science Fiction, Mystery Thriller, Suspense, Adventure, Fantasy, Crime",Tor Books,9780765354945,English,,0765354942,4.05
400354,Men at Arms,https://www.goodreads.com/book/show/400354.Men_at_Arms,Discworld #15,Terry Pratchett,"98,567","2,919",377,"1,804",,"January 1, 1993","Fantasy, Fiction, Humor, Comedy, Science Fiction Fantasy, Audiobook, Mystery",,,,,,4.40
34992959,Defy Me,https://www.goodreads.com/book/show/34992959-defy-me,Shatter Me #5,Tahereh Mafi,"185,218","18,831",357,"1,804","April 2, 2019","April 2, 2019","Fantasy, Dystopia, Young Adult, Romance, Science Fiction, Fiction, Young Adult Fantasy, Audiobook, Paranormal, Fantasy Romance",HarperTeen,9780062676399,English,,0062676393,4.29
32187419,Conversations with Friends,https://www.goodreads.com/book/show/32187419-conversations-with-friends,,Sally Rooney,"440,135","42,885",304,"1,802","July 11, 2017","May 25, 2017","Fiction, Contemporary, Romance, Literary Fiction, LGBT, Audiobook, Ireland, Novels, Adult, Queer",Hogarth,(ISBN10:,English,"Dylan Thomas Prize Nominee for Shortlist (2018), Desmond Elliott Prize Nominee for Longlist (2018), Sunday Times/Peters Fraser + Dunlop Young Writer of the Year Award (2017), Europese Literatuurprijs Nominee (2018), Rathbones Folio Prize Nominee (2018), Dublin Literary Award Nominee for Shortlist (2019)",,3.77
7800188,Virals,https://www.goodreads.com/book/show/7800188-virals,Virals #1,Kathy Reichs,"38,820","3,069",454,"1,801","November 2, 2010","November 2, 2010","Young Adult, Mystery, Science Fiction, Fiction, Fantasy, Adventure, Paranormal, Crime, Thriller, Teen",Penguin Razorbill,9781595143426,English,,1595143424,3.94
9897164,Apollyon,https://www.goodreads.com/book/show/9897164-apollyon,Covenant #4,Jennifer L. Armentrout,"54,466","3,244",343,"1,801","April 4, 2013","April 4, 2013","Fantasy, Young Adult, Paranormal, Mythology, Romance, Paranormal Romance, Greek Mythology, Urban Fantasy, Supernatural, Magic",Spencer Hill Press,9781937053161,English,,1937053164,4.33
131581599,The Raven and the Nine,https://www.goodreads.com/book/show/131581599-the-raven-and-the-nine,The Viking Blood and Blade Saga #6,Peter Gibbons,716,16,344,"1,800","June 19, 2023","Published June 19, 2023","Historical Fiction, Fiction",,,English,,,4.48
12743472,Slated,https://www.goodreads.com/book/show/12743472-slated,Slated #1,Teri Terry,"31,020","3,169",439,"1,799","May 3, 2012","May 3, 2012","Young Adult, Dystopia, Science Fiction, Fantasy, Romance, Fiction, Mystery, Thriller, Teen, Action",Orchard Books,9781408319468,English,,1408319462,4.07
2921082,The Maze of Bones,https://www.goodreads.com/book/show/2921082-the-maze-of-bones,The 39 Clues #1,Rick Riordan,"83,820","5,219",220,"1,798","September 1, 2008","September 1, 2008","Mystery, Adventure, Middle Grade, Young Adult, Fiction, Fantasy, Childrens, Audiobook, Juvenile, Action","Scholastic, Inc.",9780545060394,English,,0545060397,3.86
24378015,Never Never,https://www.goodreads.com/book/show/24378015-never-never,Never Never #1,Colleen Hoover,"115,123","12,480",158,"1,797","January 7, 2015","January 7, 2015","Romance, Young Adult, Contemporary, Mystery, New Adult, Fiction, Paranormal, Fantasy, Contemporary Romance, Suspense",Hoover Ink,,English,,,3.87
23940,Junky,https://www.goodreads.com/book/show/23940.Junky,,William S. Burroughs,"63,384","2,178",166,"1,795",,"April 15, 1953","Fiction, Classics, Literature, Novels, American, Contemporary, 20th Century",,,,,,3.85
59048542,"Searching for Ganesha: Collecting Images of the Sweet-Loving, Elephant-Headed Hindu Deity Everybody Admires",https://www.goodreads.com/book/show/59048542-searching-for-ganesha,,Paul Spencer Sochaczewski,671,15,244,"1,792","October 21, 2021","Published October 21, 2021","Education, Nonfiction, Inspirational, How To",Explorer's Eye Press,,English,,,4.36
51791252,The Vanishing Half,https://www.goodreads.com/book/show/51791252-the-vanishing-half,,Brit Bennett,"717,966","56,238",343,"1,790","June 2, 2020","June 2, 2020","Fiction, Historical Fiction, Contemporary, Audiobook, Literary Fiction, Race, Historical, Adult, Book Club, Adult Fiction",Riverhead Books,,English,"Orwell Prize Nominee for Political Fiction for Longlist (2021), Women's Prize for Fiction Nominee for Shortlist (2021), Goodreads Choice Award for Historical Fiction (2020), NAACP Image Award Nominee for Fiction (2021), Book of the Month Book of the Year Award (2020), Reading Women Award Nominee for Fiction (2020), Aspen Words Literary Prize Nominee for Longlist (2021), Long Island Reads (2021)",,4.16
